csvid,text,label,cleaned_text,text_length,cleaned_word_count,tokens,filtered_text,stopwords_removed,filtered_word_count,tokens_str
1,"I feel sad and worthless lately, nothing seems enjoyable",Depression,i feel sad and worthless lately nothing seems enjoyable,55,9,"['feel', 'sad', 'worthless', 'lately', 'nothing', 'seems', 'enjoyable']",feel sad worthless lately nothing seems enjoyable,2,7,feel sad worthless lately nothing seems enjoyable
2,I can't stop worrying about small things all the time,Anxiety,i cant stop worrying about small things all the time,52,10,"['cant', 'stop', 'worrying', 'small', 'things', 'time']",cant stop worrying small things time,4,6,cant stop worrying small things time
3,I'm feeling optimistic and calm today,Normal,im feeling optimistic and calm today,36,6,"['im', 'feeling', 'optimistic', 'calm', 'today']",im feeling optimistic calm today,1,5,im feeling optimistic calm today
4,My emotions swing from excitement to deep sadness quickly,Bipolar,my emotions swing from excitement to deep sadness quickly,57,9,"['emotions', 'swing', 'excitement', 'deep', 'sadness', 'quickly']",emotions swing excitement deep sadness quickly,3,6,emotions swing excitement deep sadness quickly
5,I get distracted every few minutes while working,ADHD,i get distracted every few minutes while working,48,8,"['get', 'distracted', 'every', 'minutes', 'working']",get distracted every minutes working,3,5,get distracted every minutes working
6,I wake up sweating from nightmares about past trauma,PTSD,i wake up sweating from nightmares about past trauma,52,9,"['wake', 'sweating', 'nightmares', 'past', 'trauma']",wake sweating nightmares past trauma,4,5,wake sweating nightmares past trauma
7,I wash my hands over and over even when they're clean,OCD,i wash my hands over and over even when theyre clean,52,11,"['wash', 'hands', 'even', 'theyre', 'clean']",wash hands even theyre clean,6,5,wash hands even theyre clean
8,"I feel tired, hopeless, and don't want to do anything",Depression,i feel tired hopeless and dont want to do anything,50,10,"['feel', 'tired', 'hopeless', 'dont', 'want', 'anything']",feel tired hopeless dont want anything,4,6,feel tired hopeless dont want anything
9,I get panic attacks whenever I think about the future,Anxiety,i get panic attacks whenever i think about the future,53,10,"['get', 'panic', 'attacks', 'whenever', 'think', 'future']",get panic attacks whenever think future,4,6,get panic attacks whenever think future
10,"I'm focused, happy, and enjoying my day",Normal,im focused happy and enjoying my day,36,7,"['im', 'focused', 'happy', 'enjoying', 'day']",im focused happy enjoying day,2,5,im focused happy enjoying day
11,"One moment I'm full of energy, then I suddenly crash",Bipolar,one moment im full of energy then i suddenly crash,50,10,"['one', 'moment', 'im', 'full', 'energy', 'suddenly', 'crash']",one moment im full energy suddenly crash,3,7,one moment im full energy suddenly crash
12,I can't finish any task without losing focus,ADHD,i cant finish any task without losing focus,43,8,"['cant', 'finish', 'task', 'without', 'losing', 'focus']",cant finish task without losing focus,2,6,cant finish task without losing focus
13,Loud noises remind me of things I want to forget,PTSD,loud noises remind me of things i want to forget,48,10,"['loud', 'noises', 'remind', 'things', 'want', 'forget']",loud noises remind things want forget,4,6,loud noises remind things want forget
14,I have to check the stove multiple times before leaving home,OCD,i have to check the stove multiple times before leaving home,60,11,"['check', 'stove', 'multiple', 'times', 'leaving', 'home']",check stove multiple times leaving home,5,6,check stove multiple times leaving home
15,I feel like crying without any reason,Depression,i feel like crying without any reason,37,7,"['feel', 'like', 'crying', 'without', 'reason']",feel like crying without reason,2,5,feel like crying without reason
16,I'm nervous before talking to anyone new,Anxiety,im nervous before talking to anyone new,39,7,"['im', 'nervous', 'talking', 'anyone', 'new']",im nervous talking anyone new,2,5,im nervous talking anyone new
17,Life feels balanced and peaceful today,Normal,life feels balanced and peaceful today,38,6,"['life', 'feels', 'balanced', 'peaceful', 'today']",life feels balanced peaceful today,1,5,life feels balanced peaceful today
18,"Sometimes I talk too fast, then suddenly feel drained",Bipolar,sometimes i talk too fast then suddenly feel drained,52,9,"['sometimes', 'talk', 'fast', 'suddenly', 'feel', 'drained']",sometimes talk fast suddenly feel drained,3,6,sometimes talk fast suddenly feel drained
19,I keep jumping between multiple unfinished tasks,ADHD,i keep jumping between multiple unfinished tasks,48,7,"['keep', 'jumping', 'multiple', 'unfinished', 'tasks']",keep jumping multiple unfinished tasks,2,5,keep jumping multiple unfinished tasks
20,I get flashbacks from the accident whenever I hear sirens,PTSD,i get flashbacks from the accident whenever i hear sirens,57,10,"['get', 'flashbacks', 'accident', 'whenever', 'hear', 'sirens']",get flashbacks accident whenever hear sirens,4,6,get flashbacks accident whenever hear sirens
21,I organize my desk again and again until it feels right,OCD,i organize my desk again and again until it feels right,55,11,"['organize', 'desk', 'feels', 'right']",organize desk feels right,7,4,organize desk feels right
22,I can't find joy even in things I used to love,Depression,i cant find joy even in things i used to love,45,11,"['cant', 'find', 'joy', 'even', 'things', 'used', 'love']",cant find joy even things used love,4,7,cant find joy even things used love
23,My chest feels tight and I can't breathe when anxious,Anxiety,my chest feels tight and i cant breathe when anxious,52,10,"['chest', 'feels', 'tight', 'cant', 'breathe', 'anxious']",chest feels tight cant breathe anxious,4,6,chest feels tight cant breathe anxious
24,I feel healthy and mentally clear today,Normal,i feel healthy and mentally clear today,39,7,"['feel', 'healthy', 'mentally', 'clear', 'today']",feel healthy mentally clear today,2,5,feel healthy mentally clear today
25,"I make big plans one day, then lose all motivation the next",Bipolar,i make big plans one day then lose all motivation the next,58,12,"['make', 'big', 'plans', 'one', 'day', 'lose', 'motivation', 'next']",make big plans one day lose motivation next,4,8,make big plans one day lose motivation next
26,I forget what I was doing within seconds,ADHD,i forget what i was doing within seconds,40,8,"['forget', 'within', 'seconds']",forget within seconds,5,3,forget within seconds
27,Certain smells trigger painful memories for me,PTSD,certain smells trigger painful memories for me,46,7,"['certain', 'smells', 'trigger', 'painful', 'memories']",certain smells trigger painful memories,2,5,certain smells trigger painful memories
28,I count things repeatedly until it feels perfect,OCD,i count things repeatedly until it feels perfect,48,8,"['count', 'things', 'repeatedly', 'feels', 'perfect']",count things repeatedly feels perfect,3,5,count things repeatedly feels perfect
29,I feel empty and worthless most mornings,Depression,i feel empty and worthless most mornings,40,7,"['feel', 'empty', 'worthless', 'mornings']",feel empty worthless mornings,3,4,feel empty worthless mornings
30,I overthink every decision I make,Anxiety,i overthink every decision i make,33,6,"['overthink', 'every', 'decision', 'make']",overthink every decision make,2,4,overthink every decision make
31,I'm grateful and content with my progress,Normal,im grateful and content with my progress,40,7,"['im', 'grateful', 'content', 'progress']",im grateful content progress,3,4,im grateful content progress
32,"I stay up all night with racing thoughts, then crash hard",Bipolar,i stay up all night with racing thoughts then crash hard,56,11,"['stay', 'night', 'racing', 'thoughts', 'crash', 'hard']",stay night racing thoughts crash hard,5,6,stay night racing thoughts crash hard
33,I can't focus in class or meetings at all,ADHD,i cant focus in class or meetings at all,40,9,"['cant', 'focus', 'class', 'meetings']",cant focus class meetings,5,4,cant focus class meetings
34,I avoid places that remind me of what happened,PTSD,i avoid places that remind me of what happened,46,9,"['avoid', 'places', 'remind', 'happened']",avoid places remind happened,5,4,avoid places remind happened
35,I need to check every lock in the house before sleeping,OCD,i need to check every lock in the house before sleeping,55,11,"['need', 'check', 'every', 'lock', 'house', 'sleeping']",need check every lock house sleeping,5,6,need check every lock house sleeping
36,I feel like life has no meaning,Depression,i feel like life has no meaning,31,7,"['feel', 'like', 'life', 'meaning']",feel like life meaning,3,4,feel like life meaning
37,I constantly feel like something bad is about to happen,Anxiety,i constantly feel like something bad is about to happen,55,10,"['constantly', 'feel', 'like', 'something', 'bad', 'happen']",constantly feel like something bad happen,4,6,constantly feel like something bad happen
38,I feel calm and in control lately,Normal,i feel calm and in control lately,33,7,"['feel', 'calm', 'control', 'lately']",feel calm control lately,3,4,feel calm control lately
39,"I start many projects when I'm high, then lose interest fast",Bipolar,i start many projects when im high then lose interest fast,58,11,"['start', 'many', 'projects', 'im', 'high', 'lose', 'interest', 'fast']",start many projects im high lose interest fast,3,8,start many projects im high lose interest fast
40,I'm easily distracted by any sound or movement,ADHD,im easily distracted by any sound or movement,45,8,"['im', 'easily', 'distracted', 'sound', 'movement']",im easily distracted sound movement,3,5,im easily distracted sound movement
41,I wake up scared from the same nightmare every night,PTSD,i wake up scared from the same nightmare every night,52,10,"['wake', 'scared', 'nightmare', 'every', 'night']",wake scared nightmare every night,5,5,wake scared nightmare every night
42,I keep cleaning the same spot repeatedly to feel calm,OCD,i keep cleaning the same spot repeatedly to feel calm,53,10,"['keep', 'cleaning', 'spot', 'repeatedly', 'feel', 'calm']",keep cleaning spot repeatedly feel calm,4,6,keep cleaning spot repeatedly feel calm
43,I feel hopeless even when everything is fine around me,Depression,i feel hopeless even when everything is fine around me,54,10,"['feel', 'hopeless', 'even', 'everything', 'fine', 'around']",feel hopeless even everything fine around,4,6,feel hopeless even everything fine around
44,I can't stop my mind from running through all possibilities,Anxiety,i cant stop my mind from running through all possibilities,58,10,"['cant', 'stop', 'mind', 'running', 'possibilities']",cant stop mind running possibilities,5,5,cant stop mind running possibilities
45,"I’m relaxed, positive, and looking forward to my day",Normal,im relaxed positive and looking forward to my day,49,9,"['im', 'relaxed', 'positive', 'looking', 'forward', 'day']",im relaxed positive looking forward day,3,6,im relaxed positive looking forward day
46,"Sometimes I feel like I can do anything, then crash completely",Bipolar,sometimes i feel like i can do anything then crash completely,61,11,"['sometimes', 'feel', 'like', 'anything', 'crash', 'completely']",sometimes feel like anything crash completely,5,6,sometimes feel like anything crash completely
47,I lose focus and forget what I was supposed to do,ADHD,i lose focus and forget what i was supposed to do,49,11,"['lose', 'focus', 'forget', 'supposed']",lose focus forget supposed,7,4,lose focus forget supposed
48,I get triggered easily by things related to my past,PTSD,i get triggered easily by things related to my past,51,10,"['get', 'triggered', 'easily', 'things', 'related', 'past']",get triggered easily things related past,4,6,get triggered easily things related past
49,I have to align everything perfectly on my desk,OCD,i have to align everything perfectly on my desk,47,9,"['align', 'everything', 'perfectly', 'desk']",align everything perfectly desk,5,4,align everything perfectly desk
50,I'm exhausted emotionally and mentally every day,Depression,im exhausted emotionally and mentally every day,47,7,"['im', 'exhausted', 'emotionally', 'mentally', 'every', 'day']",im exhausted emotionally mentally every day,1,6,im exhausted emotionally mentally every day
51,My hands shake when I'm nervous about small things,Anxiety,my hands shake when im nervous about small things,49,9,"['hands', 'shake', 'im', 'nervous', 'small', 'things']",hands shake im nervous small things,3,6,hands shake im nervous small things
52,I feel emotionally stable and grateful,Normal,i feel emotionally stable and grateful,38,6,"['feel', 'emotionally', 'stable', 'grateful']",feel emotionally stable grateful,2,4,feel emotionally stable grateful
53,I make impulsive decisions when I'm overly energetic,Bipolar,i make impulsive decisions when im overly energetic,51,8,"['make', 'impulsive', 'decisions', 'im', 'overly', 'energetic']",make impulsive decisions im overly energetic,2,6,make impulsive decisions im overly energetic
54,I start reading a book and switch to my phone instantly,ADHD,i start reading a book and switch to my phone instantly,55,11,"['start', 'reading', 'book', 'switch', 'phone', 'instantly']",start reading book switch phone instantly,5,6,start reading book switch phone instantly
55,I avoid people because they remind me of painful events,PTSD,i avoid people because they remind me of painful events,55,10,"['avoid', 'people', 'remind', 'painful', 'events']",avoid people remind painful events,5,5,avoid people remind painful events
56,I repeat certain phrases in my mind to feel safe,OCD,i repeat certain phrases in my mind to feel safe,48,10,"['repeat', 'certain', 'phrases', 'mind', 'feel', 'safe']",repeat certain phrases mind feel safe,4,6,repeat certain phrases mind feel safe
57,I feel like I’m drowning in sadness for no reason,Depression,i feel like im drowning in sadness for no reason,48,10,"['feel', 'like', 'im', 'drowning', 'sadness', 'reason']",feel like im drowning sadness reason,4,6,feel like im drowning sadness reason
58,I constantly feel tense and on edge,Anxiety,i constantly feel tense and on edge,35,7,"['constantly', 'feel', 'tense', 'edge']",constantly feel tense edge,3,4,constantly feel tense edge
59,I feel mentally fresh and balanced today,Normal,i feel mentally fresh and balanced today,40,7,"['feel', 'mentally', 'fresh', 'balanced', 'today']",feel mentally fresh balanced today,2,5,feel mentally fresh balanced today
60,My moods jump from confidence to despair within hours,Bipolar,my moods jump from confidence to despair within hours,53,9,"['moods', 'jump', 'confidence', 'despair', 'within', 'hours']",moods jump confidence despair within hours,3,6,moods jump confidence despair within hours
61,I get easily bored even with interesting work,ADHD,i get easily bored even with interesting work,45,8,"['get', 'easily', 'bored', 'even', 'interesting', 'work']",get easily bored even interesting work,2,6,get easily bored even interesting work
62,I relive the accident scene in my head again and again,PTSD,i relive the accident scene in my head again and again,54,11,"['relive', 'accident', 'scene', 'head']",relive accident scene head,7,4,relive accident scene head
63,I must touch objects in a specific pattern to feel okay,OCD,i must touch objects in a specific pattern to feel okay,55,11,"['must', 'touch', 'objects', 'specific', 'pattern', 'feel', 'okay']",must touch objects specific pattern feel okay,4,7,must touch objects specific pattern feel okay
64,I don’t enjoy socializing or even talking anymore,Depression,i dont enjoy socializing or even talking anymore,48,8,"['dont', 'enjoy', 'socializing', 'even', 'talking', 'anymore']",dont enjoy socializing even talking anymore,2,6,dont enjoy socializing even talking anymore
65,I worry excessively about things that might never happen,Anxiety,i worry excessively about things that might never happen,56,9,"['worry', 'excessively', 'things', 'might', 'never', 'happen']",worry excessively things might never happen,3,6,worry excessively things might never happen
66,I feel motivated and peaceful at the same time,Normal,i feel motivated and peaceful at the same time,46,9,"['feel', 'motivated', 'peaceful', 'time']",feel motivated peaceful time,5,4,feel motivated peaceful time
67,"Sometimes I’m full of ideas and energy, then feel numb",Bipolar,sometimes im full of ideas and energy then feel numb,52,10,"['sometimes', 'im', 'full', 'ideas', 'energy', 'feel', 'numb']",sometimes im full ideas energy feel numb,3,7,sometimes im full ideas energy feel numb
68,I can’t organize my thoughts long enough to complete tasks,ADHD,i cant organize my thoughts long enough to complete tasks,57,10,"['cant', 'organize', 'thoughts', 'long', 'enough', 'complete', 'tasks']",cant organize thoughts long enough complete tasks,3,7,cant organize thoughts long enough complete tasks
69,Certain sounds make me feel terrified for no reason,PTSD,certain sounds make me feel terrified for no reason,51,9,"['certain', 'sounds', 'make', 'feel', 'terrified', 'reason']",certain sounds make feel terrified reason,3,6,certain sounds make feel terrified reason
70,I keep rewriting words until they look perfect,OCD,i keep rewriting words until they look perfect,46,8,"['keep', 'rewriting', 'words', 'look', 'perfect']",keep rewriting words look perfect,3,5,keep rewriting words look perfect
71,I feel worthless and isolated all the time,Depression,i feel worthless and isolated all the time,42,8,"['feel', 'worthless', 'isolated', 'time']",feel worthless isolated time,4,4,feel worthless isolated time
72,I get nervous stomachaches before every small event,Anxiety,i get nervous stomachaches before every small event,51,8,"['get', 'nervous', 'stomachaches', 'every', 'small', 'event']",get nervous stomachaches every small event,2,6,get nervous stomachaches every small event
73,I’m enjoying my hobbies and feeling productive,Normal,im enjoying my hobbies and feeling productive,45,7,"['im', 'enjoying', 'hobbies', 'feeling', 'productive']",im enjoying hobbies feeling productive,2,5,im enjoying hobbies feeling productive
74,"I talk nonstop when I’m excited, then regret it later",Bipolar,i talk nonstop when im excited then regret it later,51,10,"['talk', 'nonstop', 'im', 'excited', 'regret', 'later']",talk nonstop im excited regret later,4,6,talk nonstop im excited regret later
75,I jump between different apps and forget my main task,ADHD,i jump between different apps and forget my main task,53,10,"['jump', 'different', 'apps', 'forget', 'main', 'task']",jump different apps forget main task,4,6,jump different apps forget main task
76,I can't sleep because of recurring traumatic dreams,PTSD,i cant sleep because of recurring traumatic dreams,50,8,"['cant', 'sleep', 'recurring', 'traumatic', 'dreams']",cant sleep recurring traumatic dreams,3,5,cant sleep recurring traumatic dreams
77,I keep counting my steps until I reach a specific number,OCD,i keep counting my steps until i reach a specific number,56,11,"['keep', 'counting', 'steps', 'reach', 'specific', 'number']",keep counting steps reach specific number,5,6,keep counting steps reach specific number
78,I have no energy or interest in doing anything,Depression,i have no energy or interest in doing anything,46,9,"['energy', 'interest', 'anything']",energy interest anything,6,3,energy interest anything
79,My heart races and I feel dizzy when anxious,Anxiety,my heart races and i feel dizzy when anxious,44,9,"['heart', 'races', 'feel', 'dizzy', 'anxious']",heart races feel dizzy anxious,4,5,heart races feel dizzy anxious
80,I feel strong and emotionally balanced,Normal,i feel strong and emotionally balanced,38,6,"['feel', 'strong', 'emotionally', 'balanced']",feel strong emotionally balanced,2,4,feel strong emotionally balanced
81,"I feel invincible one day, then too tired to get up the next",Bipolar,i feel invincible one day then too tired to get up the next,59,13,"['feel', 'invincible', 'one', 'day', 'tired', 'get', 'next']",feel invincible one day tired get next,6,7,feel invincible one day tired get next
82,I can’t stay focused even for five minutes,ADHD,i cant stay focused even for five minutes,41,8,"['cant', 'stay', 'focused', 'even', 'five', 'minutes']",cant stay focused even five minutes,2,6,cant stay focused even five minutes
83,I get sudden images of my trauma during the day,PTSD,i get sudden images of my trauma during the day,47,10,"['get', 'sudden', 'images', 'trauma', 'day']",get sudden images trauma day,5,5,get sudden images trauma day
84,I have to arrange my clothes in a specific order,OCD,i have to arrange my clothes in a specific order,48,10,"['arrange', 'clothes', 'specific', 'order']",arrange clothes specific order,6,4,arrange clothes specific order
85,I feel constantly sad for no reason,Depression,i feel constantly sad for no reason,35,7,"['feel', 'constantly', 'sad', 'reason']",feel constantly sad reason,3,4,feel constantly sad reason
86,I overanalyze every conversation and feel anxious,Anxiety,i overanalyze every conversation and feel anxious,49,7,"['overanalyze', 'every', 'conversation', 'feel', 'anxious']",overanalyze every conversation feel anxious,2,5,overanalyze every conversation feel anxious
87,I feel peaceful and thankful for my friends,Normal,i feel peaceful and thankful for my friends,43,8,"['feel', 'peaceful', 'thankful', 'friends']",feel peaceful thankful friends,4,4,feel peaceful thankful friends
88,Sometimes I spend money recklessly then regret it later,Bipolar,sometimes i spend money recklessly then regret it later,55,9,"['sometimes', 'spend', 'money', 'recklessly', 'regret', 'later']",sometimes spend money recklessly regret later,3,6,sometimes spend money recklessly regret later
89,I’m easily distracted even during important work,ADHD,im easily distracted even during important work,47,7,"['im', 'easily', 'distracted', 'even', 'important', 'work']",im easily distracted even important work,1,6,im easily distracted even important work
90,I can’t stop thinking about what happened to me years ago,PTSD,i cant stop thinking about what happened to me years ago,56,11,"['cant', 'stop', 'thinking', 'happened', 'years', 'ago']",cant stop thinking happened years ago,5,6,cant stop thinking happened years ago
91,I repeat certain actions until they feel 'just right',OCD,i repeat certain actions until they feel just right,51,9,"['repeat', 'certain', 'actions', 'feel', 'right']",repeat certain actions feel right,4,5,repeat certain actions feel right
92,I feel exhausted and empty every morning,Depression,i feel exhausted and empty every morning,40,7,"['feel', 'exhausted', 'empty', 'every', 'morning']",feel exhausted empty every morning,2,5,feel exhausted empty every morning
93,I keep fearing something bad will happen to my family,Anxiety,i keep fearing something bad will happen to my family,53,10,"['keep', 'fearing', 'something', 'bad', 'happen', 'family']",keep fearing something bad happen family,4,6,keep fearing something bad happen family
94,I feel emotionally stable and ready to work hard,Normal,i feel emotionally stable and ready to work hard,48,9,"['feel', 'emotionally', 'stable', 'ready', 'work', 'hard']",feel emotionally stable ready work hard,3,6,feel emotionally stable ready work hard
95,My mood switches from excited to sad in minutes,Bipolar,my mood switches from excited to sad in minutes,47,9,"['mood', 'switches', 'excited', 'sad', 'minutes']",mood switches excited sad minutes,4,5,mood switches excited sad minutes
96,I find it hard to pay attention during conversations,ADHD,i find it hard to pay attention during conversations,52,9,"['find', 'hard', 'pay', 'attention', 'conversations']",find hard pay attention conversations,4,5,find hard pay attention conversations
97,I get vivid flashbacks when I hear loud noises,PTSD,i get vivid flashbacks when i hear loud noises,46,9,"['get', 'vivid', 'flashbacks', 'hear', 'loud', 'noises']",get vivid flashbacks hear loud noises,3,6,get vivid flashbacks hear loud noises
98,I check all windows and doors repeatedly every night,OCD,i check all windows and doors repeatedly every night,52,9,"['check', 'windows', 'doors', 'repeatedly', 'every', 'night']",check windows doors repeatedly every night,3,6,check windows doors repeatedly every night
99,I have lost interest in everything I once loved,Depression,i have lost interest in everything i once loved,47,9,"['lost', 'interest', 'everything', 'loved']",lost interest everything loved,5,4,lost interest everything loved
100,I constantly think about possible future disasters,Anxiety,i constantly think about possible future disasters,50,7,"['constantly', 'think', 'possible', 'future', 'disasters']",constantly think possible future disasters,2,5,constantly think possible future disasters
101,Getting out of bed feels like an impossible task these days,Depression,getting out of bed feels like an impossible task these days,59,11,"['getting', 'bed', 'feels', 'like', 'impossible', 'task', 'days']",getting bed feels like impossible task days,4,7,getting bed feels like impossible task days
102,My mind races with 'what if' scenarios that I can't control,Anxiety,my mind races with what if scenarios that i cant control,56,11,"['mind', 'races', 'scenarios', 'cant', 'control']",mind races scenarios cant control,6,5,mind races scenarios cant control
103,I feel confident in my decisions and ready for the day,Normal,i feel confident in my decisions and ready for the day,54,11,"['feel', 'confident', 'decisions', 'ready', 'day']",feel confident decisions ready day,6,5,feel confident decisions ready day
