csvid,text,label,cleaned_text,text_length,cleaned_word_count,tokens,filtered_text,stopwords_removed,filtered_word_count,tokens_str
197,I feel like I'm always looking over my shoulder,PTSD,i feel like im always looking over my shoulder,46,9,"['feel', 'like', 'im', 'always', 'looking', 'shoulder']",feel like im always looking shoulder,3,6,feel like im always looking shoulder
198,I have to step over cracks in the sidewalk,OCD,i have to step over cracks in the sidewalk,42,9,"['step', 'cracks', 'sidewalk']",step cracks sidewalk,6,3,step cracks sidewalk
199,The world seems gray and uninteresting to me,Depression,the world seems gray and uninteresting to me,44,8,"['world', 'seems', 'gray', 'uninteresting']",world seems gray uninteresting,4,4,world seems gray uninteresting
200,I'm constantly worried about my health and dying,Anxiety,im constantly worried about my health and dying,47,8,"['im', 'constantly', 'worried', 'health', 'dying']",im constantly worried health dying,3,5,im constantly worried health dying
201,I'm feeling positive and it's making my work easier,Normal,im feeling positive and its making my work easier,49,9,"['im', 'feeling', 'positive', 'making', 'work', 'easier']",im feeling positive making work easier,3,6,im feeling positive making work easier
202,I can go from euphoric to suicidal in the same day,Bipolar,i can go from euphoric to suicidal in the same day,50,11,"['go', 'euphoric', 'suicidal', 'day']",go euphoric suicidal day,7,4,go euphoric suicidal day
203,"I fidget constantly, tapping my feet or clicking a pen",ADHD,i fidget constantly tapping my feet or clicking a pen,53,10,"['fidget', 'constantly', 'tapping', 'feet', 'clicking', 'pen']",fidget constantly tapping feet clicking pen,4,6,fidget constantly tapping feet clicking pen
204,I feel alienated from others because they can't understand my past,PTSD,i feel alienated from others because they cant understand my past,65,11,"['feel', 'alienated', 'others', 'cant', 'understand', 'past']",feel alienated others cant understand past,5,6,feel alienated others cant understand past
205,I feel a sense of dread if things are not in their proper place,OCD,i feel a sense of dread if things are not in their proper place,63,14,"['feel', 'sense', 'dread', 'things', 'proper', 'place']",feel sense dread things proper place,8,6,feel sense dread things proper place
206,I've been ignoring calls and texts from my friends for weeks,Depression,ive been ignoring calls and texts from my friends for weeks,59,11,"['ive', 'ignoring', 'calls', 'texts', 'friends', 'weeks']",ive ignoring calls texts friends weeks,5,6,ive ignoring calls texts friends weeks
207,"I'm afraid of making a mistake, so I double-check everything",Anxiety,im afraid of making a mistake so i doublecheck everything,57,10,"['im', 'afraid', 'making', 'mistake', 'doublecheck', 'everything']",im afraid making mistake doublecheck everything,4,6,im afraid making mistake doublecheck everything
208,I feel grateful for the good people in my life today,Normal,i feel grateful for the good people in my life today,52,11,"['feel', 'grateful', 'good', 'people', 'life', 'today']",feel grateful good people life today,5,6,feel grateful good people life today
209,I feel restless and can't sit still; I need to be doing something,Bipolar,i feel restless and cant sit still i need to be doing something,63,13,"['feel', 'restless', 'cant', 'sit', 'still', 'need', 'something']",feel restless cant sit still need something,6,7,feel restless cant sit still need something
210,My mind drifts away when people are talking to me,ADHD,my mind drifts away when people are talking to me,49,10,"['mind', 'drifts', 'away', 'people', 'talking']",mind drifts away people talking,5,5,mind drifts away people talking
211,I experience the traumatic event over and over in my mind,PTSD,i experience the traumatic event over and over in my mind,57,11,"['experience', 'traumatic', 'event', 'mind']",experience traumatic event mind,7,4,experience traumatic event mind
212,"I have a fear of losing things, so I hoard useless items",OCD,i have a fear of losing things so i hoard useless items,55,12,"['fear', 'losing', 'things', 'hoard', 'useless', 'items']",fear losing things hoard useless items,6,6,fear losing things hoard useless items
213,"I have trouble making simple decisions, like what to eat",Depression,i have trouble making simple decisions like what to eat,55,10,"['trouble', 'making', 'simple', 'decisions', 'like', 'eat']",trouble making simple decisions like eat,4,6,trouble making simple decisions like eat
214,I feel a sense of impending doom for no apparent reason,Anxiety,i feel a sense of impending doom for no apparent reason,55,11,"['feel', 'sense', 'impending', 'doom', 'apparent', 'reason']",feel sense impending doom apparent reason,5,6,feel sense impending doom apparent reason
215,My energy levels are stable and I feel good,Normal,my energy levels are stable and i feel good,43,9,"['energy', 'levels', 'stable', 'feel', 'good']",energy levels stable feel good,4,5,energy levels stable feel good
216,I get easily annoyed and snap at people during my highs,Bipolar,i get easily annoyed and snap at people during my highs,55,11,"['get', 'easily', 'annoyed', 'snap', 'people', 'highs']",get easily annoyed snap people highs,5,6,get easily annoyed snap people highs
217,I struggle to organize my tasks and prioritize what's important,ADHD,i struggle to organize my tasks and prioritize whats important,62,10,"['struggle', 'organize', 'tasks', 'prioritize', 'whats', 'important']",struggle organize tasks prioritize whats important,4,6,struggle organize tasks prioritize whats important
218,I feel like a different person since the traumatic event,PTSD,i feel like a different person since the traumatic event,56,10,"['feel', 'like', 'different', 'person', 'since', 'traumatic', 'event']",feel like different person since traumatic event,3,7,feel like different person since traumatic event
219,I ask for reassurance about my decisions constantly,OCD,i ask for reassurance about my decisions constantly,51,8,"['ask', 'reassurance', 'decisions', 'constantly']",ask reassurance decisions constantly,4,4,ask reassurance decisions constantly
220,I have persistent thoughts that I am not good enough,Depression,i have persistent thoughts that i am not good enough,52,10,"['persistent', 'thoughts', 'good', 'enough']",persistent thoughts good enough,6,4,persistent thoughts good enough
221,I feel sick to my stomach when I think about my to-do list,Anxiety,i feel sick to my stomach when i think about my todo list,57,13,"['feel', 'sick', 'stomach', 'think', 'todo', 'list']",feel sick stomach think todo list,7,6,feel sick stomach think todo list
222,I feel emotionally and physically healthy,Normal,i feel emotionally and physically healthy,41,6,"['feel', 'emotionally', 'physically', 'healthy']",feel emotionally physically healthy,2,4,feel emotionally physically healthy
223,"I make grand, unrealistic plans when I'm feeling up",Bipolar,i make grand unrealistic plans when im feeling up,49,9,"['make', 'grand', 'unrealistic', 'plans', 'im', 'feeling']",make grand unrealistic plans im feeling,3,6,make grand unrealistic plans im feeling
224,I'm always losing track of time,ADHD,im always losing track of time,30,6,"['im', 'always', 'losing', 'track', 'time']",im always losing track time,1,5,im always losing track time
225,I feel like the world is an unsafe and dangerous place,PTSD,i feel like the world is an unsafe and dangerous place,54,11,"['feel', 'like', 'world', 'unsafe', 'dangerous', 'place']",feel like world unsafe dangerous place,5,6,feel like world unsafe dangerous place
226,I have a compulsion to touch things in a specific order,OCD,i have a compulsion to touch things in a specific order,55,11,"['compulsion', 'touch', 'things', 'specific', 'order']",compulsion touch things specific order,6,5,compulsion touch things specific order
227,I just want to sleep and never wake up,Depression,i just want to sleep and never wake up,38,9,"['want', 'sleep', 'never', 'wake']",want sleep never wake,5,4,want sleep never wake
228,I'm hyper-aware of my heartbeat and breathing when I'm anxious,Anxiety,im hyperaware of my heartbeat and breathing when im anxious,59,10,"['im', 'hyperaware', 'heartbeat', 'breathing', 'im', 'anxious']",im hyperaware heartbeat breathing im anxious,4,6,im hyperaware heartbeat breathing im anxious
229,Life feels manageable and I am in control,Normal,life feels manageable and i am in control,41,8,"['life', 'feels', 'manageable', 'control']",life feels manageable control,4,4,life feels manageable control
230,My thoughts are like a whirlwind I cannot escape from,Bipolar,my thoughts are like a whirlwind i cannot escape from,53,10,"['thoughts', 'like', 'whirlwind', 'escape']",thoughts like whirlwind escape,7,4,thoughts like whirlwind escape
231,I have trouble with tasks that require sustained mental effort,ADHD,i have trouble with tasks that require sustained mental effort,62,10,"['trouble', 'tasks', 'require', 'sustained', 'mental', 'effort']",trouble tasks require sustained mental effort,4,6,trouble tasks require sustained mental effort
232,I lost interest in activities that were once important to me after the event,PTSD,i lost interest in activities that were once important to me after the event,76,14,"['lost', 'interest', 'activities', 'important', 'event']",lost interest activities important event,9,5,lost interest activities important event
233,I am preoccupied with symmetry and exactness,OCD,i am preoccupied with symmetry and exactness,44,7,"['preoccupied', 'symmetry', 'exactness']",preoccupied symmetry exactness,4,3,preoccupied symmetry exactness
234,I feel emotionally numb and can't seem to cry,Depression,i feel emotionally numb and cant seem to cry,44,9,"['feel', 'emotionally', 'numb', 'cant', 'seem', 'cry']",feel emotionally numb cant seem cry,3,6,feel emotionally numb cant seem cry
235,I have an irrational fear of crowded places,Anxiety,i have an irrational fear of crowded places,43,8,"['irrational', 'fear', 'crowded', 'places']",irrational fear crowded places,4,4,irrational fear crowded places
236,I feel mentally strong and capable of handling stress,Normal,i feel mentally strong and capable of handling stress,53,9,"['feel', 'mentally', 'strong', 'capable', 'handling', 'stress']",feel mentally strong capable handling stress,3,6,feel mentally strong capable handling stress
237,"I have periods of intense goal-directed activity, then nothing",Bipolar,i have periods of intense goaldirected activity then nothing,60,9,"['periods', 'intense', 'goaldirected', 'activity', 'nothing']",periods intense goaldirected activity nothing,4,5,periods intense goaldirected activity nothing
238,My thoughts are jumbled and I can't seem to think straight,ADHD,my thoughts are jumbled and i cant seem to think straight,57,11,"['thoughts', 'jumbled', 'cant', 'seem', 'think', 'straight']",thoughts jumbled cant seem think straight,5,6,thoughts jumbled cant seem think straight
239,I push people away to avoid getting hurt again,PTSD,i push people away to avoid getting hurt again,46,9,"['push', 'people', 'away', 'avoid', 'getting', 'hurt']",push people away avoid getting hurt,3,6,push people away avoid getting hurt
240,I have a pathological need to keep things perfectly clean,OCD,i have a pathological need to keep things perfectly clean,57,10,"['pathological', 'need', 'keep', 'things', 'perfectly', 'clean']",pathological need keep things perfectly clean,4,6,pathological need keep things perfectly clean
241,I have unexplained aches and pains all the time,Depression,i have unexplained aches and pains all the time,47,9,"['unexplained', 'aches', 'pains', 'time']",unexplained aches pains time,5,4,unexplained aches pains time
242,I obsess over small details and potential negative outcomes,Anxiety,i obsess over small details and potential negative outcomes,59,9,"['obsess', 'small', 'details', 'potential', 'negative', 'outcomes']",obsess small details potential negative outcomes,3,6,obsess small details potential negative outcomes
243,I feel optimistic about my future,Normal,i feel optimistic about my future,33,6,"['feel', 'optimistic', 'future']",feel optimistic future,3,3,feel optimistic future
244,I take on more than I can handle when I'm manic,Bipolar,i take on more than i can handle when im manic,46,11,"['take', 'handle', 'im', 'manic']",take handle im manic,7,4,take handle im manic
245,I am easily overwhelmed by sensory input like noise and lights,ADHD,i am easily overwhelmed by sensory input like noise and lights,62,11,"['easily', 'overwhelmed', 'sensory', 'input', 'like', 'noise', 'lights']",easily overwhelmed sensory input like noise lights,4,7,easily overwhelmed sensory input like noise lights
246,I struggle with memory problems related to the trauma,PTSD,i struggle with memory problems related to the trauma,53,9,"['struggle', 'memory', 'problems', 'related', 'trauma']",struggle memory problems related trauma,4,5,struggle memory problems related trauma
247,I have to arrange my food on the plate in a very specific way,OCD,i have to arrange my food on the plate in a very specific way,61,14,"['arrange', 'food', 'plate', 'specific', 'way']",arrange food plate specific way,9,5,arrange food plate specific way
248,I feel like I'm moving in slow motion compared to everyone else,Depression,i feel like im moving in slow motion compared to everyone else,62,12,"['feel', 'like', 'im', 'moving', 'slow', 'motion', 'compared', 'everyone', 'else']",feel like im moving slow motion compared everyone else,3,9,feel like im moving slow motion compared everyone else
249,I feel a jolt of panic every time my phone rings unexpectedly,Anxiety,i feel a jolt of panic every time my phone rings unexpectedly,61,12,"['feel', 'jolt', 'panic', 'every', 'time', 'phone', 'rings', 'unexpectedly']",feel jolt panic every time phone rings unexpectedly,4,8,feel jolt panic every time phone rings unexpectedly
250,I am at peace with my choices and my current situation,Normal,i am at peace with my choices and my current situation,54,11,"['peace', 'choices', 'current', 'situation']",peace choices current situation,7,4,peace choices current situation
251,I feel so agitated I could crawl out of my skin,Bipolar,i feel so agitated i could crawl out of my skin,47,11,"['feel', 'agitated', 'could', 'crawl', 'skin']",feel agitated could crawl skin,6,5,feel agitated could crawl skin
252,I struggle to follow step-by-step instructions,ADHD,i struggle to follow stepbystep instructions,44,6,"['struggle', 'follow', 'stepbystep', 'instructions']",struggle follow stepbystep instructions,2,4,struggle follow stepbystep instructions
253,"I have a sense of a foreshortened future, like I won't live long",PTSD,i have a sense of a foreshortened future like i wont live long,62,13,"['sense', 'foreshortened', 'future', 'like', 'wont', 'live', 'long']",sense foreshortened future like wont live long,6,7,sense foreshortened future like wont live long
254,I have superstitious fears about certain numbers or colors,OCD,i have superstitious fears about certain numbers or colors,58,9,"['superstitious', 'fears', 'certain', 'numbers', 'colors']",superstitious fears certain numbers colors,4,5,superstitious fears certain numbers colors
255,I have no motivation to take care of my personal hygiene,Depression,i have no motivation to take care of my personal hygiene,56,11,"['motivation', 'take', 'care', 'personal', 'hygiene']",motivation take care personal hygiene,6,5,motivation take care personal hygiene
256,I'm worried that people can see how anxious I am,Anxiety,im worried that people can see how anxious i am,47,10,"['im', 'worried', 'people', 'see', 'anxious']",im worried people see anxious,5,5,im worried people see anxious
257,I feel a sense of accomplishment from my work today,Normal,i feel a sense of accomplishment from my work today,51,10,"['feel', 'sense', 'accomplishment', 'work', 'today']",feel sense accomplishment work today,5,5,feel sense accomplishment work today
258,"I feel powerful and important, then suddenly feel insignificant",Bipolar,i feel powerful and important then suddenly feel insignificant,62,9,"['feel', 'powerful', 'important', 'suddenly', 'feel', 'insignificant']",feel powerful important suddenly feel insignificant,3,6,feel powerful important suddenly feel insignificant
259,I have a very short temper and get frustrated easily,ADHD,i have a very short temper and get frustrated easily,52,10,"['short', 'temper', 'get', 'frustrated', 'easily']",short temper get frustrated easily,5,5,short temper get frustrated easily
260,I am startled by any unexpected touch,PTSD,i am startled by any unexpected touch,37,7,"['startled', 'unexpected', 'touch']",startled unexpected touch,4,3,startled unexpected touch
261,I avoid stepping on lines on the pavement,OCD,i avoid stepping on lines on the pavement,41,8,"['avoid', 'stepping', 'lines', 'pavement']",avoid stepping lines pavement,4,4,avoid stepping lines pavement
262,I feel like I'm a spectator in my own life,Depression,i feel like im a spectator in my own life,41,10,"['feel', 'like', 'im', 'spectator', 'life']",feel like im spectator life,5,5,feel like im spectator life
263,My thoughts are spiraling out of control with worry,Anxiety,my thoughts are spiraling out of control with worry,51,9,"['thoughts', 'spiraling', 'control', 'worry']",thoughts spiraling control worry,5,4,thoughts spiraling control worry
264,I feel a pleasant sense of focus and productivity,Normal,i feel a pleasant sense of focus and productivity,49,9,"['feel', 'pleasant', 'sense', 'focus', 'productivity']",feel pleasant sense focus productivity,4,5,feel pleasant sense focus productivity
265,My behavior becomes reckless and impulsive when I'm manic,Bipolar,my behavior becomes reckless and impulsive when im manic,56,9,"['behavior', 'becomes', 'reckless', 'impulsive', 'im', 'manic']",behavior becomes reckless impulsive im manic,3,6,behavior becomes reckless impulsive im manic
266,I blurt out things without thinking and regret them later,ADHD,i blurt out things without thinking and regret them later,57,10,"['blurt', 'things', 'without', 'thinking', 'regret', 'later']",blurt things without thinking regret later,4,6,blurt things without thinking regret later
267,I feel like I can never relax or let my guard down,PTSD,i feel like i can never relax or let my guard down,50,12,"['feel', 'like', 'never', 'relax', 'let', 'guard']",feel like never relax let guard,6,6,feel like never relax let guard
268,I have to say a certain phrase in my head to prevent bad things from happening,OCD,i have to say a certain phrase in my head to prevent bad things from happening,78,16,"['say', 'certain', 'phrase', 'head', 'prevent', 'bad', 'things', 'happening']",say certain phrase head prevent bad things happening,8,8,say certain phrase head prevent bad things happening
269,I feel an overwhelming sense of emptiness inside,Depression,i feel an overwhelming sense of emptiness inside,48,8,"['feel', 'overwhelming', 'sense', 'emptiness', 'inside']",feel overwhelming sense emptiness inside,3,5,feel overwhelming sense emptiness inside
270,I am constantly second-guessing my decisions,Anxiety,i am constantly secondguessing my decisions,43,6,"['constantly', 'secondguessing', 'decisions']",constantly secondguessing decisions,3,3,constantly secondguessing decisions
271,I woke up on the right side of the bed today,Normal,i woke up on the right side of the bed today,44,11,"['woke', 'right', 'side', 'bed', 'today']",woke right side bed today,6,5,woke right side bed today
272,I have an inflated sense of self-importance during my highs,Bipolar,i have an inflated sense of selfimportance during my highs,58,10,"['inflated', 'sense', 'selfimportance', 'highs']",inflated sense selfimportance highs,6,4,inflated sense selfimportance highs
273,I'm disorganized and can never find anything,ADHD,im disorganized and can never find anything,43,7,"['im', 'disorganized', 'never', 'find', 'anything']",im disorganized never find anything,2,5,im disorganized never find anything
274,I feel emotionally detached from the people I love,PTSD,i feel emotionally detached from the people i love,50,9,"['feel', 'emotionally', 'detached', 'people', 'love']",feel emotionally detached people love,4,5,feel emotionally detached people love
275,I'm obsessed with keeping things in even numbers,OCD,im obsessed with keeping things in even numbers,47,8,"['im', 'obsessed', 'keeping', 'things', 'even', 'numbers']",im obsessed keeping things even numbers,2,6,im obsessed keeping things even numbers
276,I have a very critical inner voice that puts me down,Depression,i have a very critical inner voice that puts me down,52,11,"['critical', 'inner', 'voice', 'puts']",critical inner voice puts,7,4,critical inner voice puts
277,I feel like I'm going to lose control,Anxiety,i feel like im going to lose control,36,8,"['feel', 'like', 'im', 'going', 'lose', 'control']",feel like im going lose control,2,6,feel like im going lose control
278,I feel a nice balance between work and relaxation,Normal,i feel a nice balance between work and relaxation,49,9,"['feel', 'nice', 'balance', 'work', 'relaxation']",feel nice balance work relaxation,4,5,feel nice balance work relaxation
279,My mood can flip from ecstatic to deeply depressed in an instant,Bipolar,my mood can flip from ecstatic to deeply depressed in an instant,64,12,"['mood', 'flip', 'ecstatic', 'deeply', 'depressed', 'instant']",mood flip ecstatic deeply depressed instant,6,6,mood flip ecstatic deeply depressed instant
280,I have poor time management skills and am always rushing,ADHD,i have poor time management skills and am always rushing,56,10,"['poor', 'time', 'management', 'skills', 'always', 'rushing']",poor time management skills always rushing,4,6,poor time management skills always rushing
281,I am constantly on the lookout for anything that could be a threat,PTSD,i am constantly on the lookout for anything that could be a threat,66,13,"['constantly', 'lookout', 'anything', 'could', 'threat']",constantly lookout anything could threat,8,5,constantly lookout anything could threat
282,"I have a fear that if I don't do my ritual, something bad will happen to my family",OCD,i have a fear that if i dont do my ritual something bad will happen to my family,80,18,"['fear', 'dont', 'ritual', 'something', 'bad', 'happen', 'family']",fear dont ritual something bad happen family,11,7,fear dont ritual something bad happen family
283,I can't remember the last time I felt truly happy,Depression,i cant remember the last time i felt truly happy,48,10,"['cant', 'remember', 'last', 'time', 'felt', 'truly', 'happy']",cant remember last time felt truly happy,3,7,cant remember last time felt truly happy
284,I have a fear of being in situations where escape might be difficult,Anxiety,i have a fear of being in situations where escape might be difficult,68,13,"['fear', 'situations', 'escape', 'might', 'difficult']",fear situations escape might difficult,8,5,fear situations escape might difficult
285,I feel well-rested and mentally prepared for the week,Normal,i feel wellrested and mentally prepared for the week,52,9,"['feel', 'wellrested', 'mentally', 'prepared', 'week']",feel wellrested mentally prepared week,4,5,feel wellrested mentally prepared week
286,I have a decreased need for sleep during manic episodes,Bipolar,i have a decreased need for sleep during manic episodes,55,10,"['decreased', 'need', 'sleep', 'manic', 'episodes']",decreased need sleep manic episodes,5,5,decreased need sleep manic episodes
287,I make careless mistakes in my work because I rush through it,ADHD,i make careless mistakes in my work because i rush through it,61,12,"['make', 'careless', 'mistakes', 'work', 'rush']",make careless mistakes work rush,7,5,make careless mistakes work rush
288,I have difficulty feeling positive emotions like love or happiness,PTSD,i have difficulty feeling positive emotions like love or happiness,66,10,"['difficulty', 'feeling', 'positive', 'emotions', 'like', 'love', 'happiness']",difficulty feeling positive emotions like love happiness,3,7,difficulty feeling positive emotions like love happiness
289,I have to wash my hands until they feel raw,OCD,i have to wash my hands until they feel raw,43,10,"['wash', 'hands', 'feel', 'raw']",wash hands feel raw,6,4,wash hands feel raw
290,I feel physically and emotionally drained for no reason,Depression,i feel physically and emotionally drained for no reason,55,9,"['feel', 'physically', 'emotionally', 'drained', 'reason']",feel physically emotionally drained reason,4,5,feel physically emotionally drained reason
291,I feel a constant sense of unease that I can't shake,Anxiety,i feel a constant sense of unease that i cant shake,51,11,"['feel', 'constant', 'sense', 'unease', 'cant', 'shake']",feel constant sense unease cant shake,5,6,feel constant sense unease cant shake
292,I am enjoying a peaceful and uneventful day,Normal,i am enjoying a peaceful and uneventful day,43,8,"['enjoying', 'peaceful', 'uneventful', 'day']",enjoying peaceful uneventful day,4,4,enjoying peaceful uneventful day
293,I engage in risky behaviors when I'm in a high mood,Bipolar,i engage in risky behaviors when im in a high mood,50,11,"['engage', 'risky', 'behaviors', 'im', 'high', 'mood']",engage risky behaviors im high mood,5,6,engage risky behaviors im high mood
294,I have a hard time waiting my turn in conversations or lines,ADHD,i have a hard time waiting my turn in conversations or lines,60,12,"['hard', 'time', 'waiting', 'turn', 'conversations', 'lines']",hard time waiting turn conversations lines,6,6,hard time waiting turn conversations lines
295,"I have recurring, distressing dreams about the event",PTSD,i have recurring distressing dreams about the event,51,8,"['recurring', 'distressing', 'dreams', 'event']",recurring distressing dreams event,4,4,recurring distressing dreams event
