csvid,text,label,cleaned_text,text_length,cleaned_word_count,tokens,filtered_text,stopwords_removed,filtered_word_count,tokens_str
755,I feel like my hard work is finally paying off,Normal,i feel like my hard work is finally paying off,46,10,"['feel', 'like', 'hard', 'work', 'finally', 'paying']",feel like hard work finally paying,4,6,feel like hard work finally paying
756,"I feel pressured to keep talking, even when I have nothing to say",Bipolar,i feel pressured to keep talking even when i have nothing to say,64,13,"['feel', 'pressured', 'keep', 'talking', 'even', 'nothing', 'say']",feel pressured keep talking even nothing say,6,7,feel pressured keep talking even nothing say
757,My impulsivity has led to financial problems,ADHD,my impulsivity has led to financial problems,44,7,"['impulsivity', 'led', 'financial', 'problems']",impulsivity led financial problems,3,4,impulsivity led financial problems
758,I'm having difficulty maintaining relationships since the trauma,PTSD,im having difficulty maintaining relationships since the trauma,63,8,"['im', 'difficulty', 'maintaining', 'relationships', 'since', 'trauma']",im difficulty maintaining relationships since trauma,2,6,im difficulty maintaining relationships since trauma
759,I'm afraid of stepping on cracks in the pavement,OCD,im afraid of stepping on cracks in the pavement,47,9,"['im', 'afraid', 'stepping', 'cracks', 'pavement']",im afraid stepping cracks pavement,4,5,im afraid stepping cracks pavement
760,I am isolating myself from the world because it feels safer,Depression,i am isolating myself from the world because it feels safer,59,11,"['isolating', 'world', 'feels', 'safer']",isolating world feels safer,7,4,isolating world feels safer
761,I get intense stomach cramps and digestive issues from anxiety,Anxiety,i get intense stomach cramps and digestive issues from anxiety,62,10,"['get', 'intense', 'stomach', 'cramps', 'digestive', 'issues', 'anxiety']",get intense stomach cramps digestive issues anxiety,3,7,get intense stomach cramps digestive issues anxiety
762,I am at peace with my past and looking forward to the future,Normal,i am at peace with my past and looking forward to the future,60,13,"['peace', 'past', 'looking', 'forward', 'future']",peace past looking forward future,8,5,peace past looking forward future
763,My thoughts are racing so fast I feel dizzy,Bipolar,my thoughts are racing so fast i feel dizzy,43,9,"['thoughts', 'racing', 'fast', 'feel', 'dizzy']",thoughts racing fast feel dizzy,4,5,thoughts racing fast feel dizzy
764,I have trouble winding down and my mind is always 'on',ADHD,i have trouble winding down and my mind is always on,52,11,"['trouble', 'winding', 'mind', 'always']",trouble winding mind always,7,4,trouble winding mind always
765,I have a hard time trusting anyone completely,PTSD,i have a hard time trusting anyone completely,45,8,"['hard', 'time', 'trusting', 'anyone', 'completely']",hard time trusting anyone completely,3,5,hard time trusting anyone completely
766,I have to check that all the doors and windows are locked multiple times,OCD,i have to check that all the doors and windows are locked multiple times,72,14,"['check', 'doors', 'windows', 'locked', 'multiple', 'times']",check doors windows locked multiple times,8,6,check doors windows locked multiple times
767,I feel like I'm living under a dark cloud that follows me everywhere,Depression,i feel like im living under a dark cloud that follows me everywhere,67,13,"['feel', 'like', 'im', 'living', 'dark', 'cloud', 'follows', 'everywhere']",feel like im living dark cloud follows everywhere,5,8,feel like im living dark cloud follows everywhere
768,I'm terrified of being the center of attention,Anxiety,im terrified of being the center of attention,45,8,"['im', 'terrified', 'center', 'attention']",im terrified center attention,4,4,im terrified center attention
769,I feel refreshed and ready to have a great day,Normal,i feel refreshed and ready to have a great day,46,10,"['feel', 'refreshed', 'ready', 'great', 'day']",feel refreshed ready great day,5,5,feel refreshed ready great day
770,I can shift from euphoria to tears in a matter of minutes,Bipolar,i can shift from euphoria to tears in a matter of minutes,57,12,"['shift', 'euphoria', 'tears', 'matter', 'minutes']",shift euphoria tears matter minutes,7,5,shift euphoria tears matter minutes
771,I find myself daydreaming excessively to escape from my responsibilities,ADHD,i find myself daydreaming excessively to escape from my responsibilities,72,10,"['find', 'daydreaming', 'excessively', 'escape', 'responsibilities']",find daydreaming excessively escape responsibilities,5,5,find daydreaming excessively escape responsibilities
772,I have a sense of being different or separate from other people,PTSD,i have a sense of being different or separate from other people,63,12,"['sense', 'different', 'separate', 'people']",sense different separate people,8,4,sense different separate people
773,I have intrusive thoughts about yelling out inappropriate things in quiet places,OCD,i have intrusive thoughts about yelling out inappropriate things in quiet places,80,12,"['intrusive', 'thoughts', 'yelling', 'inappropriate', 'things', 'quiet', 'places']",intrusive thoughts yelling inappropriate things quiet places,5,7,intrusive thoughts yelling inappropriate things quiet places
774,I'm so emotionally exhausted I don't have the energy to talk,Depression,im so emotionally exhausted i dont have the energy to talk,58,11,"['im', 'emotionally', 'exhausted', 'dont', 'energy', 'talk']",im emotionally exhausted dont energy talk,5,6,im emotionally exhausted dont energy talk
775,I'm afraid to try new things because I might fail,Anxiety,im afraid to try new things because i might fail,48,10,"['im', 'afraid', 'try', 'new', 'things', 'might', 'fail']",im afraid try new things might fail,3,7,im afraid try new things might fail
776,I feel secure in who I am as a person,Normal,i feel secure in who i am as a person,37,10,"['feel', 'secure', 'person']",feel secure person,7,3,feel secure person
777,I have an exaggerated sense of self-confidence when I'm manic,Bipolar,i have an exaggerated sense of selfconfidence when im manic,59,10,"['exaggerated', 'sense', 'selfconfidence', 'im', 'manic']",exaggerated sense selfconfidence im manic,5,5,exaggerated sense selfconfidence im manic
778,I often lose my place in conversations because I get distracted,ADHD,i often lose my place in conversations because i get distracted,63,11,"['often', 'lose', 'place', 'conversations', 'get', 'distracted']",often lose place conversations get distracted,5,6,often lose place conversations get distracted
779,I feel emotionally and physically on edge all the time,PTSD,i feel emotionally and physically on edge all the time,54,10,"['feel', 'emotionally', 'physically', 'edge', 'time']",feel emotionally physically edge time,5,5,feel emotionally physically edge time
780,I'm preoccupied with keeping my possessions in a specific order,OCD,im preoccupied with keeping my possessions in a specific order,62,10,"['im', 'preoccupied', 'keeping', 'possessions', 'specific', 'order']",im preoccupied keeping possessions specific order,4,6,im preoccupied keeping possessions specific order
781,I'm having trouble concentrating on work because of my low mood,Depression,im having trouble concentrating on work because of my low mood,62,11,"['im', 'trouble', 'concentrating', 'work', 'low', 'mood']",im trouble concentrating work low mood,5,6,im trouble concentrating work low mood
782,I feel like I'm going to lose my mind from all the stress,Anxiety,i feel like im going to lose my mind from all the stress,56,13,"['feel', 'like', 'im', 'going', 'lose', 'mind', 'stress']",feel like im going lose mind stress,6,7,feel like im going lose mind stress
783,I'm enjoying a period of calm and stability,Normal,im enjoying a period of calm and stability,42,8,"['im', 'enjoying', 'period', 'calm', 'stability']",im enjoying period calm stability,3,5,im enjoying period calm stability
784,My thinking can become grandiose and delusional when I'm manic,Bipolar,my thinking can become grandiose and delusional when im manic,61,10,"['thinking', 'become', 'grandiose', 'delusional', 'im', 'manic']",thinking become grandiose delusional im manic,4,6,thinking become grandiose delusional im manic
785,I'm not a good listener because my mind is always somewhere else,ADHD,im not a good listener because my mind is always somewhere else,63,12,"['im', 'good', 'listener', 'mind', 'always', 'somewhere', 'else']",im good listener mind always somewhere else,5,7,im good listener mind always somewhere else
786,"I'm constantly scanning for threats, even in my own home",PTSD,im constantly scanning for threats even in my own home,54,10,"['im', 'constantly', 'scanning', 'threats', 'even', 'home']",im constantly scanning threats even home,4,6,im constantly scanning threats even home
787,I feel the need to confess to minor wrongdoings constantly,OCD,i feel the need to confess to minor wrongdoings constantly,58,10,"['feel', 'need', 'confess', 'minor', 'wrongdoings', 'constantly']",feel need confess minor wrongdoings constantly,4,6,feel need confess minor wrongdoings constantly
788,I've lost interest in sex and physical intimacy,Depression,ive lost interest in sex and physical intimacy,46,8,"['ive', 'lost', 'interest', 'sex', 'physical', 'intimacy']",ive lost interest sex physical intimacy,2,6,ive lost interest sex physical intimacy
789,I have a fear of heights that makes it hard to be in tall buildings,Anxiety,i have a fear of heights that makes it hard to be in tall buildings,67,15,"['fear', 'heights', 'makes', 'hard', 'tall', 'buildings']",fear heights makes hard tall buildings,9,6,fear heights makes hard tall buildings
790,I feel like I'm living a meaningful and fulfilling life,Normal,i feel like im living a meaningful and fulfilling life,54,10,"['feel', 'like', 'im', 'living', 'meaningful', 'fulfilling', 'life']",feel like im living meaningful fulfilling life,3,7,feel like im living meaningful fulfilling life
791,My depression can get so bad that I experience psychosis,Bipolar,my depression can get so bad that i experience psychosis,56,10,"['depression', 'get', 'bad', 'experience', 'psychosis']",depression get bad experience psychosis,5,5,depression get bad experience psychosis
792,I have a hard time with tasks that have multiple steps,ADHD,i have a hard time with tasks that have multiple steps,54,11,"['hard', 'time', 'tasks', 'multiple', 'steps']",hard time tasks multiple steps,6,5,hard time tasks multiple steps
793,"I feel like the trauma was my fault, even though I know it wasn't",PTSD,i feel like the trauma was my fault even though i know it wasnt,63,14,"['feel', 'like', 'trauma', 'fault', 'even', 'though', 'know', 'wasnt']",feel like trauma fault even though know wasnt,6,8,feel like trauma fault even though know wasnt
794,"I have to count things in my environment, like ceiling tiles or cars",OCD,i have to count things in my environment like ceiling tiles or cars,67,13,"['count', 'things', 'environment', 'like', 'ceiling', 'tiles', 'cars']",count things environment like ceiling tiles cars,6,7,count things environment like ceiling tiles cars
795,I have unexplained physical symptoms like headaches and body aches,Depression,i have unexplained physical symptoms like headaches and body aches,66,10,"['unexplained', 'physical', 'symptoms', 'like', 'headaches', 'body', 'aches']",unexplained physical symptoms like headaches body aches,3,7,unexplained physical symptoms like headaches body aches
796,"I get overwhelmed by sensory input, like loud noises and bright lights",Anxiety,i get overwhelmed by sensory input like loud noises and bright lights,69,12,"['get', 'overwhelmed', 'sensory', 'input', 'like', 'loud', 'noises', 'bright', 'lights']",get overwhelmed sensory input like loud noises bright lights,3,9,get overwhelmed sensory input like loud noises bright lights
797,I feel grateful for the simple pleasures of life,Normal,i feel grateful for the simple pleasures of life,48,9,"['feel', 'grateful', 'simple', 'pleasures', 'life']",feel grateful simple pleasures life,4,5,feel grateful simple pleasures life
798,My family has pointed out my erratic and impulsive behavior,Bipolar,my family has pointed out my erratic and impulsive behavior,59,10,"['family', 'pointed', 'erratic', 'impulsive', 'behavior']",family pointed erratic impulsive behavior,5,5,family pointed erratic impulsive behavior
799,I have poor working memory and forget instructions immediately,ADHD,i have poor working memory and forget instructions immediately,62,9,"['poor', 'working', 'memory', 'forget', 'instructions', 'immediately']",poor working memory forget instructions immediately,3,6,poor working memory forget instructions immediately
800,I feel like I can never be my old self again,PTSD,i feel like i can never be my old self again,44,11,"['feel', 'like', 'never', 'old', 'self']",feel like never old self,6,5,feel like never old self
801,I have a fear of being contaminated by thoughts as well as germs,OCD,i have a fear of being contaminated by thoughts as well as germs,64,13,"['fear', 'contaminated', 'thoughts', 'well', 'germs']",fear contaminated thoughts well germs,8,5,fear contaminated thoughts well germs
802,I feel like I'm wearing a lead vest all the time,Depression,i feel like im wearing a lead vest all the time,47,11,"['feel', 'like', 'im', 'wearing', 'lead', 'vest', 'time']",feel like im wearing lead vest time,4,7,feel like im wearing lead vest time
803,My mind is a whirlwind of worst-case scenarios,Anxiety,my mind is a whirlwind of worstcase scenarios,45,8,"['mind', 'whirlwind', 'worstcase', 'scenarios']",mind whirlwind worstcase scenarios,4,4,mind whirlwind worstcase scenarios
804,"I feel calm and collected, even in stressful situations",Normal,i feel calm and collected even in stressful situations,54,9,"['feel', 'calm', 'collected', 'even', 'stressful', 'situations']",feel calm collected even stressful situations,3,6,feel calm collected even stressful situations
805,I feel like I'm invincible and can't be harmed during my highs,Bipolar,i feel like im invincible and cant be harmed during my highs,60,12,"['feel', 'like', 'im', 'invincible', 'cant', 'harmed', 'highs']",feel like im invincible cant harmed highs,5,7,feel like im invincible cant harmed highs
806,I'm often called 'lazy' or 'unmotivated' but it's not true,ADHD,im often called lazy or unmotivated but its not true,52,10,"['im', 'often', 'called', 'lazy', 'unmotivated', 'true']",im often called lazy unmotivated true,4,6,im often called lazy unmotivated true
807,I feel like my future has been stolen from me,PTSD,i feel like my future has been stolen from me,45,10,"['feel', 'like', 'future', 'stolen']",feel like future stolen,6,4,feel like future stolen
808,"I have to repeat actions until they feel 'just right,' which can take hours",OCD,i have to repeat actions until they feel just right which can take hours,72,14,"['repeat', 'actions', 'feel', 'right', 'take', 'hours']",repeat actions feel right take hours,8,6,repeat actions feel right take hours
809,I feel like I'm on the outside looking in on my own life,Depression,i feel like im on the outside looking in on my own life,55,13,"['feel', 'like', 'im', 'outside', 'looking', 'life']",feel like im outside looking life,7,6,feel like im outside looking life
810,"I experience intense depersonalization, feeling detached from myself",Anxiety,i experience intense depersonalization feeling detached from myself,67,8,"['experience', 'intense', 'depersonalization', 'feeling', 'detached']",experience intense depersonalization feeling detached,3,5,experience intense depersonalization feeling detached
811,I'm feeling very content and satisfied with my relationships,Normal,im feeling very content and satisfied with my relationships,59,9,"['im', 'feeling', 'content', 'satisfied', 'relationships']",im feeling content satisfied relationships,4,5,im feeling content satisfied relationships
812,My depressive episodes leave me feeling suicidal and hopeless,Bipolar,my depressive episodes leave me feeling suicidal and hopeless,61,9,"['depressive', 'episodes', 'leave', 'feeling', 'suicidal', 'hopeless']",depressive episodes leave feeling suicidal hopeless,3,6,depressive episodes leave feeling suicidal hopeless
813,I can be very blunt and tactless without meaning to be,ADHD,i can be very blunt and tactless without meaning to be,54,11,"['blunt', 'tactless', 'without', 'meaning']",blunt tactless without meaning,7,4,blunt tactless without meaning
814,I feel like I aged 20 years on the day of the trauma,PTSD,i feel like i aged years on the day of the trauma,49,12,"['feel', 'like', 'aged', 'years', 'day', 'trauma']",feel like aged years day trauma,6,6,feel like aged years day trauma
815,I have a need for everything to be clean and sterile,OCD,i have a need for everything to be clean and sterile,52,11,"['need', 'everything', 'clean', 'sterile']",need everything clean sterile,7,4,need everything clean sterile
816,I have a constant feeling of being 'on edge' and irritable,Depression,i have a constant feeling of being on edge and irritable,56,11,"['constant', 'feeling', 'edge', 'irritable']",constant feeling edge irritable,7,4,constant feeling edge irritable
817,"I have an irrational fear of being trapped, like in an elevator",Anxiety,i have an irrational fear of being trapped like in an elevator,62,12,"['irrational', 'fear', 'trapped', 'like', 'elevator']",irrational fear trapped like elevator,7,5,irrational fear trapped like elevator
818,I feel like I'm making positive changes in my life,Normal,i feel like im making positive changes in my life,49,10,"['feel', 'like', 'im', 'making', 'positive', 'changes', 'life']",feel like im making positive changes life,3,7,feel like im making positive changes life
819,I'm either extremely productive or can't get out of bed for days,Bipolar,im either extremely productive or cant get out of bed for days,62,12,"['im', 'either', 'extremely', 'productive', 'cant', 'get', 'bed', 'days']",im either extremely productive cant get bed days,4,8,im either extremely productive cant get bed days
820,I have a low frustration tolerance and a quick temper,ADHD,i have a low frustration tolerance and a quick temper,53,10,"['low', 'frustration', 'tolerance', 'quick', 'temper']",low frustration tolerance quick temper,5,5,low frustration tolerance quick temper
821,I am hyper-aware of my surroundings to an exhausting degree,PTSD,i am hyperaware of my surroundings to an exhausting degree,58,10,"['hyperaware', 'surroundings', 'exhausting', 'degree']",hyperaware surroundings exhausting degree,6,4,hyperaware surroundings exhausting degree
822,I have to arrange my clothes by color and type,OCD,i have to arrange my clothes by color and type,46,10,"['arrange', 'clothes', 'color', 'type']",arrange clothes color type,6,4,arrange clothes color type
823,I'm having thoughts that I would be better off dead,Depression,im having thoughts that i would be better off dead,50,10,"['im', 'thoughts', 'would', 'better', 'dead']",im thoughts would better dead,5,5,im thoughts would better dead
824,I'm so worried about the future that I can't enjoy the present,Anxiety,im so worried about the future that i cant enjoy the present,60,12,"['im', 'worried', 'future', 'cant', 'enjoy', 'present']",im worried future cant enjoy present,6,6,im worried future cant enjoy present
825,I feel a sense of optimism that I haven't had in a long time,Normal,i feel a sense of optimism that i havent had in a long time,59,14,"['feel', 'sense', 'optimism', 'havent', 'long', 'time']",feel sense optimism havent long time,8,6,feel sense optimism havent long time
826,My judgment becomes severely impaired when I'm manic,Bipolar,my judgment becomes severely impaired when im manic,51,8,"['judgment', 'becomes', 'severely', 'impaired', 'im', 'manic']",judgment becomes severely impaired im manic,2,6,judgment becomes severely impaired im manic
827,I have a hard time following through on my commitments,ADHD,i have a hard time following through on my commitments,54,10,"['hard', 'time', 'following', 'commitments']",hard time following commitments,6,4,hard time following commitments
828,I feel like I'm living in a different reality from everyone else,PTSD,i feel like im living in a different reality from everyone else,63,12,"['feel', 'like', 'im', 'living', 'different', 'reality', 'everyone', 'else']",feel like im living different reality everyone else,4,8,feel like im living different reality everyone else
829,I have a fear of leaving my house alone,OCD,i have a fear of leaving my house alone,39,9,"['fear', 'leaving', 'house', 'alone']",fear leaving house alone,5,4,fear leaving house alone
830,I feel like I'm in a fog that I can't think my way out of,Depression,i feel like im in a fog that i cant think my way out of,55,15,"['feel', 'like', 'im', 'fog', 'cant', 'think', 'way']",feel like im fog cant think way,8,7,feel like im fog cant think way
831,I am terrified of what other people think of me,Anxiety,i am terrified of what other people think of me,47,10,"['terrified', 'people', 'think']",terrified people think,7,3,terrified people think
832,I feel like I have a good handle on my life right now,Normal,i feel like i have a good handle on my life right now,53,13,"['feel', 'like', 'good', 'handle', 'life', 'right']",feel like good handle life right,7,6,feel like good handle life right
833,I feel like I'm moving in fast-forward while everyone else is in slow-motion,Bipolar,i feel like im moving in fastforward while everyone else is in slowmotion,73,13,"['feel', 'like', 'im', 'moving', 'fastforward', 'everyone', 'else', 'slowmotion']",feel like im moving fastforward everyone else slowmotion,5,8,feel like im moving fastforward everyone else slowmotion
834,I often tune out during long meetings or lectures,ADHD,i often tune out during long meetings or lectures,49,9,"['often', 'tune', 'long', 'meetings', 'lectures']",often tune long meetings lectures,4,5,often tune long meetings lectures
835,I have a very strong startle response to unexpected noises,PTSD,i have a very strong startle response to unexpected noises,58,10,"['strong', 'startle', 'response', 'unexpected', 'noises']",strong startle response unexpected noises,5,5,strong startle response unexpected noises
836,I need to know the exact details of a plan or I get very anxious,OCD,i need to know the exact details of a plan or i get very anxious,64,15,"['need', 'know', 'exact', 'details', 'plan', 'get', 'anxious']",need know exact details plan get anxious,8,7,need know exact details plan get anxious
837,I feel like I'm a shell of my former self,Depression,i feel like im a shell of my former self,40,10,"['feel', 'like', 'im', 'shell', 'former', 'self']",feel like im shell former self,4,6,feel like im shell former self
838,I have a fear of losing control in front of other people,Anxiety,i have a fear of losing control in front of other people,56,12,"['fear', 'losing', 'control', 'front', 'people']",fear losing control front people,7,5,fear losing control front people
839,I am feeling very peaceful and it's a welcome change,Normal,i am feeling very peaceful and its a welcome change,51,10,"['feeling', 'peaceful', 'welcome', 'change']",feeling peaceful welcome change,6,4,feeling peaceful welcome change
840,I can go from being the most talkative person in the room to mute,Bipolar,i can go from being the most talkative person in the room to mute,65,14,"['go', 'talkative', 'person', 'room', 'mute']",go talkative person room mute,9,5,go talkative person room mute
841,I have a hard time with boredom and am always seeking excitement,ADHD,i have a hard time with boredom and am always seeking excitement,64,12,"['hard', 'time', 'boredom', 'always', 'seeking', 'excitement']",hard time boredom always seeking excitement,6,6,hard time boredom always seeking excitement
842,I'm having trouble sleeping because of intrusive thoughts about the trauma,PTSD,im having trouble sleeping because of intrusive thoughts about the trauma,73,11,"['im', 'trouble', 'sleeping', 'intrusive', 'thoughts', 'trauma']",im trouble sleeping intrusive thoughts trauma,5,6,im trouble sleeping intrusive thoughts trauma
843,I have a fear of using public restrooms,OCD,i have a fear of using public restrooms,39,8,"['fear', 'using', 'public', 'restrooms']",fear using public restrooms,4,4,fear using public restrooms
844,I feel like I'm running on empty all the time,Depression,i feel like im running on empty all the time,44,10,"['feel', 'like', 'im', 'running', 'empty', 'time']",feel like im running empty time,4,6,feel like im running empty time
845,"I'm having chest pains and I'm scared it's a heart attack, but it's just anxiety",Anxiety,im having chest pains and im scared its a heart attack but its just anxiety,75,15,"['im', 'chest', 'pains', 'im', 'scared', 'heart', 'attack', 'anxiety']",im chest pains im scared heart attack anxiety,7,8,im chest pains im scared heart attack anxiety
846,I feel confident and self-assured in my decisions,Normal,i feel confident and selfassured in my decisions,48,8,"['feel', 'confident', 'selfassured', 'decisions']",feel confident selfassured decisions,4,4,feel confident selfassured decisions
847,I can feel a manic episode coming on like an approaching storm,Bipolar,i can feel a manic episode coming on like an approaching storm,62,12,"['feel', 'manic', 'episode', 'coming', 'like', 'approaching', 'storm']",feel manic episode coming like approaching storm,5,7,feel manic episode coming like approaching storm
848,"I have a tendency to hyper-focus on things I find interesting, to the exclusion of all else",ADHD,i have a tendency to hyperfocus on things i find interesting to the exclusion of all else,89,17,"['tendency', 'hyperfocus', 'things', 'find', 'interesting', 'exclusion', 'else']",tendency hyperfocus things find interesting exclusion else,10,7,tendency hyperfocus things find interesting exclusion else
