csvid,text,label,cleaned_text,text_length,cleaned_word_count,tokens,filtered_text,stopwords_removed,filtered_word_count,tokens_str
494,I have a constant fear of being abandoned,Anxiety,i have a constant fear of being abandoned,41,8,"['constant', 'fear', 'abandoned']",constant fear abandoned,5,3,constant fear abandoned
495,I feel my efforts are paying off,Normal,i feel my efforts are paying off,32,7,"['feel', 'efforts', 'paying']",feel efforts paying,4,3,feel efforts paying
496,My hypomanic episodes make me feel productive and brilliant,Bipolar,my hypomanic episodes make me feel productive and brilliant,59,9,"['hypomanic', 'episodes', 'make', 'feel', 'productive', 'brilliant']",hypomanic episodes make feel productive brilliant,3,6,hypomanic episodes make feel productive brilliant
497,I talk excessively and don't pick up on social cues to stop,ADHD,i talk excessively and dont pick up on social cues to stop,58,12,"['talk', 'excessively', 'dont', 'pick', 'social', 'cues', 'stop']",talk excessively dont pick social cues stop,5,7,talk excessively dont pick social cues stop
498,I have a strong desire for revenge against those who hurt me,PTSD,i have a strong desire for revenge against those who hurt me,60,12,"['strong', 'desire', 'revenge', 'hurt']",strong desire revenge hurt,8,4,strong desire revenge hurt
499,I have to check my pulse to make sure I'm still alive,OCD,i have to check my pulse to make sure im still alive,52,12,"['check', 'pulse', 'make', 'sure', 'im', 'still', 'alive']",check pulse make sure im still alive,5,7,check pulse make sure im still alive
500,I feel so sad that my whole body aches,Depression,i feel so sad that my whole body aches,38,9,"['feel', 'sad', 'whole', 'body', 'aches']",feel sad whole body aches,4,5,feel sad whole body aches
501,"My mind feels like a browser with too many tabs open, all of them frozen",Depression,my mind feels like a browser with too many tabs open all of them frozen,71,15,"['mind', 'feels', 'like', 'browser', 'many', 'tabs', 'open', 'frozen']",mind feels like browser many tabs open frozen,7,8,mind feels like browser many tabs open frozen
502,"I get a sudden, overwhelming sense of terror for no logical reason",Anxiety,i get a sudden overwhelming sense of terror for no logical reason,65,12,"['get', 'sudden', 'overwhelming', 'sense', 'terror', 'logical', 'reason']",get sudden overwhelming sense terror logical reason,5,7,get sudden overwhelming sense terror logical reason
503,I handled a difficult conversation today with grace and calm,Normal,i handled a difficult conversation today with grace and calm,60,10,"['handled', 'difficult', 'conversation', 'today', 'grace', 'calm']",handled difficult conversation today grace calm,4,6,handled difficult conversation today grace calm
504,I redecorated my entire house overnight; now I hate it and I'm exhausted,Bipolar,i redecorated my entire house overnight now i hate it and im exhausted,70,13,"['redecorated', 'entire', 'house', 'overnight', 'hate', 'im', 'exhausted']",redecorated entire house overnight hate im exhausted,6,7,redecorated entire house overnight hate im exhausted
505,I can't start a project until the pressure of the deadline is immense,ADHD,i cant start a project until the pressure of the deadline is immense,68,13,"['cant', 'start', 'project', 'pressure', 'deadline', 'immense']",cant start project pressure deadline immense,7,6,cant start project pressure deadline immense
506,"I feel a profound sense of detachment from my own body, like it's not mine",PTSD,i feel a profound sense of detachment from my own body like its not mine,72,15,"['feel', 'profound', 'sense', 'detachment', 'body', 'like', 'mine']",feel profound sense detachment body like mine,8,7,feel profound sense detachment body like mine
507,I have to mentally rehearse my entire day to make sure I didn't make a mistake,OCD,i have to mentally rehearse my entire day to make sure i didnt make a mistake,77,16,"['mentally', 'rehearse', 'entire', 'day', 'make', 'sure', 'didnt', 'make', 'mistake']",mentally rehearse entire day make sure didnt make mistake,7,9,mentally rehearse entire day make sure didnt make mistake
508,"Colors seem muted and food tastes bland, like the world is fading",Depression,colors seem muted and food tastes bland like the world is fading,64,12,"['colors', 'seem', 'muted', 'food', 'tastes', 'bland', 'like', 'world', 'fading']",colors seem muted food tastes bland like world fading,3,9,colors seem muted food tastes bland like world fading
509,My stomach is in knots worrying about a meeting that's a week away,Anxiety,my stomach is in knots worrying about a meeting thats a week away,65,13,"['stomach', 'knots', 'worrying', 'meeting', 'thats', 'week', 'away']",stomach knots worrying meeting thats week away,6,7,stomach knots worrying meeting thats week away
510,"I'm finding joy in my daily routine, which feels really nice",Normal,im finding joy in my daily routine which feels really nice,58,11,"['im', 'finding', 'joy', 'daily', 'routine', 'feels', 'really', 'nice']",im finding joy daily routine feels really nice,3,8,im finding joy daily routine feels really nice
511,"I feel like I have superpowers, then two days later I can't even make toast",Bipolar,i feel like i have superpowers then two days later i cant even make toast,73,15,"['feel', 'like', 'superpowers', 'two', 'days', 'later', 'cant', 'even', 'make', 'toast']",feel like superpowers two days later cant even make toast,5,10,feel like superpowers two days later cant even make toast
512,I experience intense emotional reactions to minor setbacks,ADHD,i experience intense emotional reactions to minor setbacks,58,8,"['experience', 'intense', 'emotional', 'reactions', 'minor', 'setbacks']",experience intense emotional reactions minor setbacks,2,6,experience intense emotional reactions minor setbacks
513,I can't feel happiness or love anymore; it's like those emotions are gone,PTSD,i cant feel happiness or love anymore its like those emotions are gone,70,13,"['cant', 'feel', 'happiness', 'love', 'anymore', 'like', 'emotions', 'gone']",cant feel happiness love anymore like emotions gone,5,8,cant feel happiness love anymore like emotions gone
514,"An image of a disaster will pop into my head, and I have to do a ritual to feel safe",OCD,an image of a disaster will pop into my head and i have to do a ritual to feel safe,83,20,"['image', 'disaster', 'pop', 'head', 'ritual', 'feel', 'safe']",image disaster pop head ritual feel safe,13,7,image disaster pop head ritual feel safe
515,"I feel like I'm underwater, and everyone else is moving at normal speed",Depression,i feel like im underwater and everyone else is moving at normal speed,69,13,"['feel', 'like', 'im', 'underwater', 'everyone', 'else', 'moving', 'normal', 'speed']",feel like im underwater everyone else moving normal speed,4,9,feel like im underwater everyone else moving normal speed
516,I'm convinced this minor physical symptom is a sign of a fatal disease,Anxiety,im convinced this minor physical symptom is a sign of a fatal disease,69,13,"['im', 'convinced', 'minor', 'physical', 'symptom', 'sign', 'fatal', 'disease']",im convinced minor physical symptom sign fatal disease,5,8,im convinced minor physical symptom sign fatal disease
517,I'm proud of the healthy habits I'm building for myself,Normal,im proud of the healthy habits im building for myself,53,10,"['im', 'proud', 'healthy', 'habits', 'im', 'building']",im proud healthy habits im building,4,6,im proud healthy habits im building
518,My thoughts are like a freight train with no brakes during a manic episode,Bipolar,my thoughts are like a freight train with no brakes during a manic episode,74,14,"['thoughts', 'like', 'freight', 'train', 'brakes', 'manic', 'episode']",thoughts like freight train brakes manic episode,7,7,thoughts like freight train brakes manic episode
519,My brain feels like it needs constant novelty and stimulation to stay engaged,ADHD,my brain feels like it needs constant novelty and stimulation to stay engaged,77,13,"['brain', 'feels', 'like', 'needs', 'constant', 'novelty', 'stimulation', 'stay', 'engaged']",brain feels like needs constant novelty stimulation stay engaged,4,9,brain feels like needs constant novelty stimulation stay engaged
520,"I've been engaging in risky behavior, almost like I'm testing fate",PTSD,ive been engaging in risky behavior almost like im testing fate,63,11,"['ive', 'engaging', 'risky', 'behavior', 'almost', 'like', 'im', 'testing', 'fate']",ive engaging risky behavior almost like im testing fate,2,9,ive engaging risky behavior almost like im testing fate
521,I can't leave a room until everything is perfectly aligned and symmetrical,OCD,i cant leave a room until everything is perfectly aligned and symmetrical,73,12,"['cant', 'leave', 'room', 'everything', 'perfectly', 'aligned', 'symmetrical']",cant leave room everything perfectly aligned symmetrical,5,7,cant leave room everything perfectly aligned symmetrical
522,"It feels like there's a heavy, invisible blanket smothering my motivation",Depression,it feels like theres a heavy invisible blanket smothering my motivation,71,11,"['feels', 'like', 'theres', 'heavy', 'invisible', 'blanket', 'smothering', 'motivation']",feels like theres heavy invisible blanket smothering motivation,3,8,feels like theres heavy invisible blanket smothering motivation
523,I felt like everyone was staring at me and judging me at the store today,Anxiety,i felt like everyone was staring at me and judging me at the store today,72,15,"['felt', 'like', 'everyone', 'staring', 'judging', 'store', 'today']",felt like everyone staring judging store today,8,7,felt like everyone staring judging store today
524,I'm enjoying being present and not worrying about the past or future,Normal,im enjoying being present and not worrying about the past or future,67,12,"['im', 'enjoying', 'present', 'worrying', 'past', 'future']",im enjoying present worrying past future,6,6,im enjoying present worrying past future
525,The crash after a manic period feels like the worst emotional hangover imaginable,Bipolar,the crash after a manic period feels like the worst emotional hangover imaginable,81,13,"['crash', 'manic', 'period', 'feels', 'like', 'worst', 'emotional', 'hangover', 'imaginable']",crash manic period feels like worst emotional hangover imaginable,4,9,crash manic period feels like worst emotional hangover imaginable
526,A simple criticism can send me into a spiral of self-doubt for days,ADHD,a simple criticism can send me into a spiral of selfdoubt for days,66,13,"['simple', 'criticism', 'send', 'spiral', 'selfdoubt', 'days']",simple criticism send spiral selfdoubt days,7,6,simple criticism send spiral selfdoubt days
527,I look in the mirror and sometimes feel like I'm looking at a stranger,PTSD,i look in the mirror and sometimes feel like im looking at a stranger,69,14,"['look', 'mirror', 'sometimes', 'feel', 'like', 'im', 'looking', 'stranger']",look mirror sometimes feel like im looking stranger,6,8,look mirror sometimes feel like im looking stranger
528,I'm terrified that I might accidentally cause harm to someone I care about,OCD,im terrified that i might accidentally cause harm to someone i care about,73,13,"['im', 'terrified', 'might', 'accidentally', 'cause', 'harm', 'someone', 'care']",im terrified might accidentally cause harm someone care,5,8,im terrified might accidentally cause harm someone care
529,I have to put on a mask of being 'fine' for everyone else,Depression,i have to put on a mask of being fine for everyone else,55,13,"['put', 'mask', 'fine', 'everyone', 'else']",put mask fine everyone else,8,5,put mask fine everyone else
530,The physical symptoms of my anxiety—dizziness and heart pounding—are scary,Anxiety,the physical symptoms of my anxietydizziness and heart poundingare scary,72,10,"['physical', 'symptoms', 'anxietydizziness', 'heart', 'poundingare', 'scary']",physical symptoms anxietydizziness heart poundingare scary,4,6,physical symptoms anxietydizziness heart poundingare scary
531,I feel a quiet satisfaction from finishing my tasks for the day,Normal,i feel a quiet satisfaction from finishing my tasks for the day,63,12,"['feel', 'quiet', 'satisfaction', 'finishing', 'tasks', 'day']",feel quiet satisfaction finishing tasks day,6,6,feel quiet satisfaction finishing tasks day
532,My family says they have to walk on eggshells around me because of my moods,Bipolar,my family says they have to walk on eggshells around me because of my moods,75,15,"['family', 'says', 'walk', 'eggshells', 'around', 'moods']",family says walk eggshells around moods,9,6,family says walk eggshells around moods
533,I have a closet full of supplies for hobbies I was obsessed with for a week,ADHD,i have a closet full of supplies for hobbies i was obsessed with for a week,75,16,"['closet', 'full', 'supplies', 'hobbies', 'obsessed', 'week']",closet full supplies hobbies obsessed week,10,6,closet full supplies hobbies obsessed week
534,"I keep thinking 'if only I had done something different,' the outcome would be better",PTSD,i keep thinking if only i had done something different the outcome would be better,82,15,"['keep', 'thinking', 'done', 'something', 'different', 'outcome', 'would', 'better']",keep thinking done something different outcome would better,7,8,keep thinking done something different outcome would better
535,My mind gets stuck on a particular number and I have to see it everywhere,OCD,my mind gets stuck on a particular number and i have to see it everywhere,73,15,"['mind', 'gets', 'stuck', 'particular', 'number', 'see', 'everywhere']",mind gets stuck particular number see everywhere,8,7,mind gets stuck particular number see everywhere
536,My thoughts are consumed by a sense of failure and regret,Depression,my thoughts are consumed by a sense of failure and regret,57,11,"['thoughts', 'consumed', 'sense', 'failure', 'regret']",thoughts consumed sense failure regret,6,5,thoughts consumed sense failure regret
537,"I feel a sense of unreality, as if I'm watching a movie of my life",Anxiety,i feel a sense of unreality as if im watching a movie of my life,64,15,"['feel', 'sense', 'unreality', 'im', 'watching', 'movie', 'life']",feel sense unreality im watching movie life,8,7,feel sense unreality im watching movie life
538,I feel mentally refreshed and am looking forward to new challenges,Normal,i feel mentally refreshed and am looking forward to new challenges,66,11,"['feel', 'mentally', 'refreshed', 'looking', 'forward', 'new', 'challenges']",feel mentally refreshed looking forward new challenges,4,7,feel mentally refreshed looking forward new challenges
539,"During a high, I don't need to sleep and feel completely wired with energy",Bipolar,during a high i dont need to sleep and feel completely wired with energy,72,14,"['high', 'dont', 'need', 'sleep', 'feel', 'completely', 'wired', 'energy']",high dont need sleep feel completely wired energy,6,8,high dont need sleep feel completely wired energy
540,I'll walk into a room and completely forget why I went in there,ADHD,ill walk into a room and completely forget why i went in there,62,13,"['ill', 'walk', 'room', 'completely', 'forget', 'went']",ill walk room completely forget went,7,6,ill walk room completely forget went
541,I have persistent feelings of guilt about surviving when others didn't,PTSD,i have persistent feelings of guilt about surviving when others didnt,69,11,"['persistent', 'feelings', 'guilt', 'surviving', 'others', 'didnt']",persistent feelings guilt surviving others didnt,5,6,persistent feelings guilt surviving others didnt
542,I'm preoccupied with religious questions and fears of damnation,OCD,im preoccupied with religious questions and fears of damnation,62,9,"['im', 'preoccupied', 'religious', 'questions', 'fears', 'damnation']",im preoccupied religious questions fears damnation,3,6,im preoccupied religious questions fears damnation
543,"Even small decisions feel impossible, like my brain has shut down",Depression,even small decisions feel impossible like my brain has shut down,64,11,"['even', 'small', 'decisions', 'feel', 'impossible', 'like', 'brain', 'shut']",even small decisions feel impossible like brain shut,3,8,even small decisions feel impossible like brain shut
544,I'm experiencing tunnel vision and cold sweats during my panic attacks,Anxiety,im experiencing tunnel vision and cold sweats during my panic attacks,69,11,"['im', 'experiencing', 'tunnel', 'vision', 'cold', 'sweats', 'panic', 'attacks']",im experiencing tunnel vision cold sweats panic attacks,3,8,im experiencing tunnel vision cold sweats panic attacks
545,I feel connected to the people around me and supported,Normal,i feel connected to the people around me and supported,54,10,"['feel', 'connected', 'people', 'around', 'supported']",feel connected people around supported,5,5,feel connected people around supported
546,"I make elaborate, unrealistic plans when I'm hypomanic",Bipolar,i make elaborate unrealistic plans when im hypomanic,52,8,"['make', 'elaborate', 'unrealistic', 'plans', 'im', 'hypomanic']",make elaborate unrealistic plans im hypomanic,2,6,make elaborate unrealistic plans im hypomanic
547,I can't seem to organize my thoughts well enough to write a simple email,ADHD,i cant seem to organize my thoughts well enough to write a simple email,71,14,"['cant', 'seem', 'organize', 'thoughts', 'well', 'enough', 'write', 'simple', 'email']",cant seem organize thoughts well enough write simple email,5,9,cant seem organize thoughts well enough write simple email
548,"I feel like a ghost in my own life, just watching things happen",PTSD,i feel like a ghost in my own life just watching things happen,62,13,"['feel', 'like', 'ghost', 'life', 'watching', 'things', 'happen']",feel like ghost life watching things happen,6,7,feel like ghost life watching things happen
549,I have to reread pages of a book because I'm worried I missed a secret meaning,OCD,i have to reread pages of a book because im worried i missed a secret meaning,77,16,"['reread', 'pages', 'book', 'im', 'worried', 'missed', 'secret', 'meaning']",reread pages book im worried missed secret meaning,8,8,reread pages book im worried missed secret meaning
550,I am so tired of being tired all the time,Depression,i am so tired of being tired all the time,41,10,"['tired', 'tired', 'time']",tired tired time,7,3,tired tired time
551,My fear of failure is so paralyzing that I procrastinate on everything,Anxiety,my fear of failure is so paralyzing that i procrastinate on everything,70,12,"['fear', 'failure', 'paralyzing', 'procrastinate', 'everything']",fear failure paralyzing procrastinate everything,7,5,fear failure paralyzing procrastinate everything
552,I took a moment to appreciate the beauty of nature today,Normal,i took a moment to appreciate the beauty of nature today,56,11,"['took', 'moment', 'appreciate', 'beauty', 'nature', 'today']",took moment appreciate beauty nature today,5,6,took moment appreciate beauty nature today
553,My speech becomes so fast that others can't understand what I'm saying,Bipolar,my speech becomes so fast that others cant understand what im saying,68,12,"['speech', 'becomes', 'fast', 'others', 'cant', 'understand', 'im', 'saying']",speech becomes fast others cant understand im saying,4,8,speech becomes fast others cant understand im saying
554,I have a very low tolerance for boredom and frustration,ADHD,i have a very low tolerance for boredom and frustration,55,10,"['low', 'tolerance', 'boredom', 'frustration']",low tolerance boredom frustration,6,4,low tolerance boredom frustration
555,I feel like I'm permanently broken by my past,PTSD,i feel like im permanently broken by my past,44,9,"['feel', 'like', 'im', 'permanently', 'broken', 'past']",feel like im permanently broken past,3,6,feel like im permanently broken past
556,"I have a constant, nagging doubt that I've left the oven on",OCD,i have a constant nagging doubt that ive left the oven on,57,12,"['constant', 'nagging', 'doubt', 'ive', 'left', 'oven']",constant nagging doubt ive left oven,6,6,constant nagging doubt ive left oven
557,"I feel like an actor playing a part, and I'm exhausted from the performance",Depression,i feel like an actor playing a part and im exhausted from the performance,73,14,"['feel', 'like', 'actor', 'playing', 'part', 'im', 'exhausted', 'performance']",feel like actor playing part im exhausted performance,6,8,feel like actor playing part im exhausted performance
558,I'm always on the lookout for signs that something is wrong,Anxiety,im always on the lookout for signs that something is wrong,58,11,"['im', 'always', 'lookout', 'signs', 'something', 'wrong']",im always lookout signs something wrong,5,6,im always lookout signs something wrong
559,I feel a deep sense of accomplishment and self-worth today,Normal,i feel a deep sense of accomplishment and selfworth today,57,10,"['feel', 'deep', 'sense', 'accomplishment', 'selfworth', 'today']",feel deep sense accomplishment selfworth today,4,6,feel deep sense accomplishment selfworth today
560,I swing between feeling like a creative genius and a complete fraud,Bipolar,i swing between feeling like a creative genius and a complete fraud,67,12,"['swing', 'feeling', 'like', 'creative', 'genius', 'complete', 'fraud']",swing feeling like creative genius complete fraud,5,7,swing feeling like creative genius complete fraud
561,"I thrive in chaos and high-pressure situations, but fail at simple routines",ADHD,i thrive in chaos and highpressure situations but fail at simple routines,73,12,"['thrive', 'chaos', 'highpressure', 'situations', 'fail', 'simple', 'routines']",thrive chaos highpressure situations fail simple routines,5,7,thrive chaos highpressure situations fail simple routines
562,I have a strong physical aversion to places that remind me of the trauma,PTSD,i have a strong physical aversion to places that remind me of the trauma,72,14,"['strong', 'physical', 'aversion', 'places', 'remind', 'trauma']",strong physical aversion places remind trauma,8,6,strong physical aversion places remind trauma
563,I'm worried my thoughts can make bad things happen in reality,OCD,im worried my thoughts can make bad things happen in reality,60,11,"['im', 'worried', 'thoughts', 'make', 'bad', 'things', 'happen', 'reality']",im worried thoughts make bad things happen reality,3,8,im worried thoughts make bad things happen reality
564,The sadness comes in waves and feels like it's going to drown me,Depression,the sadness comes in waves and feels like its going to drown me,63,13,"['sadness', 'comes', 'waves', 'feels', 'like', 'going', 'drown']",sadness comes waves feels like going drown,6,7,sadness comes waves feels like going drown
565,I'm having trouble breathing because my chest is so tight with worry,Anxiety,im having trouble breathing because my chest is so tight with worry,67,12,"['im', 'trouble', 'breathing', 'chest', 'tight', 'worry']",im trouble breathing chest tight worry,6,6,im trouble breathing chest tight worry
566,I'm grateful for my health and the opportunities I have,Normal,im grateful for my health and the opportunities i have,54,10,"['im', 'grateful', 'health', 'opportunities']",im grateful health opportunities,6,4,im grateful health opportunities
567,"I feel an intense pressure to keep talking, even when I have nothing to say",Bipolar,i feel an intense pressure to keep talking even when i have nothing to say,74,15,"['feel', 'intense', 'pressure', 'keep', 'talking', 'even', 'nothing', 'say']",feel intense pressure keep talking even nothing say,7,8,feel intense pressure keep talking even nothing say
568,My emotional volume is always turned up to the maximum,ADHD,my emotional volume is always turned up to the maximum,54,10,"['emotional', 'volume', 'always', 'turned', 'maximum']",emotional volume always turned maximum,5,5,emotional volume always turned maximum
569,I can't handle anyone touching me unexpectedly,PTSD,i cant handle anyone touching me unexpectedly,45,7,"['cant', 'handle', 'anyone', 'touching', 'unexpectedly']",cant handle anyone touching unexpectedly,2,5,cant handle anyone touching unexpectedly
570,I have to count my steps and end on an even number,OCD,i have to count my steps and end on an even number,50,12,"['count', 'steps', 'end', 'even', 'number']",count steps end even number,7,5,count steps end even number
571,I've been turning down invitations because I don't have the social energy,Depression,ive been turning down invitations because i dont have the social energy,71,12,"['ive', 'turning', 'invitations', 'dont', 'social', 'energy']",ive turning invitations dont social energy,6,6,ive turning invitations dont social energy
572,I avoid conflict at all costs because it makes my anxiety unbearable,Anxiety,i avoid conflict at all costs because it makes my anxiety unbearable,68,12,"['avoid', 'conflict', 'costs', 'makes', 'anxiety', 'unbearable']",avoid conflict costs makes anxiety unbearable,6,6,avoid conflict costs makes anxiety unbearable
573,I feel a sense of inner peace that I haven't felt in a while,Normal,i feel a sense of inner peace that i havent felt in a while,59,14,"['feel', 'sense', 'inner', 'peace', 'havent', 'felt']",feel sense inner peace havent felt,8,6,feel sense inner peace havent felt
574,My partner says my personality seems to change from one day to the next,Bipolar,my partner says my personality seems to change from one day to the next,71,14,"['partner', 'says', 'personality', 'seems', 'change', 'one', 'day', 'next']",partner says personality seems change one day next,6,8,partner says personality seems change one day next
575,"I have to set five alarms just to wake up, and I still oversleep",ADHD,i have to set five alarms just to wake up and i still oversleep,63,14,"['set', 'five', 'alarms', 'wake', 'still', 'oversleep']",set five alarms wake still oversleep,8,6,set five alarms wake still oversleep
